Code,URL,Titre,Contenu,Langue,Nb Caractères,Nb Mots,Date Publication,Lieu,Maladie,Source,Domaine,Résumé 50,Résumé 100,Résumé 150,Entités
code664,https://www.alaraby.co.uk/economy/%D8%A7%D9%84%D8%AC%D8%B2%D8%A7%D8%A6%D8%B1-%D8%AA%D8%B9%D9%8A%D8%AF-%D9%81%D8%AA%D8%AD-%D8%A3%D8%B3%D9%88%D8%A7%D9%82-%D8%A7%D9%84%D9%85%D9%88%D8%A7%D8%B4%D9%8A-%D8%A8%D8%B9%D8%AF-%D8%A3%D8%B2%D9%85%D8%A9-%D8%A7%D9%84%D8%AD%D9%85%D9%89-%D8%A7%D9%84%D9%82%D9%84%D8%A7%D8%B9%D9%8A%D8%A9,الجزائر تعيد فتح أسواق المواشي بعد أزمة الحمى القلاعية,"عثمان لحياني أعادت الجزائر فتح أسواق المواشي بعد تلقيح 70% من مجموع المواشي في البلاد، إثر ما يقارب الشهر على قرار إغلاقها ومنع نقل المواشي والأغنام، في أعقاب ظهور بؤر الحمى القلاعية التي تصيب الماشية في بعض ولايات البلاد. وسمح حكام الولايات، بالتنسيق مع وزارةالزراعة، بإعادة فتح الأسواق المحلية لبيع المواشي، ورفع الإجراءات التي كانت تمنع نقل المواشي بين المدن والبلدات، بما سيسمح للموالين ومربي المواشي والأبقار بحرية نقل مواشيهم وبيعها. لكن قرار إعادةفتح الأسواقتضمن أيضاً الإبقاء على حزمة إجراءات احترازية تشمل ضمان تواجد مصالح الرقابة البيطرية داخل الأسواق، وتركيز نظام أمني لفرض والتثبت من حصولالمزارعينعلى شهادات التلقيح والشهادة الصحية للمواشي والأبقار التي يتم تسويقها. وحثت السلطات المزارعين على إجراء تطهير جميع المركبات التي تستخدم لنقل المواشي والأبقار، والاستمرار في عملية التلقيح واستكمالها، كما دعت مصالح البلديات إلى تطهير الأسواق ومحيطها. وقد أعلن وزير الزراعة يوسف شرفة خلال زياراته مزارع في ولاية سطيف شرقي الجزائر، اليوم الخميس، أن ""المصالح المختصة كسبت رهان مكافحة مرض الحمى القلاعية الذي ظهر مؤخرا بتلقيح أكثر من 70% منالثروة الحيوانيةالمعنية بهذه العملية في ظرف وجيز""، مشيرا إلى أن ""عملية التلقيح مستمرة في إطار حماية الثروة الحيوانية"". الجزائر وموريتانيا.. مشاريع مكثفة تمهد لتكامل اقتصادي ومرض الحمى القلاعية هو مرض فيروسي شديد العدوى يصيب الماشية، من أبقار وأغنام وماعز، لكنه لا ينتقل إلى الإنسان. وكانت السلطات قد قررت قبل أقل من شهر غلق جميع أسواق المواشي بعد انتشار الحمىى القلاعية، كإجراء احترازي لتفادي انتشار المرض عن طريق تنقل واحتكاك المواشي. وأطلقت المصالح في قطاع الزراعة حملة تلقيح واسعة للمواشي والأبقار في كل الولايات، للتوقي من انتشار هذا المرض. وكثفت الحكومة جهودها للحد من تفشي مرض الحمى القلاعية، بعد التأكد من الانتشار الخطير في ولايات جزائرية مختلفة. واستجابة للتوجه الحكومي، كانت وزارة الفلاحة والتنمية الريفية قد أطلقت حملة تلقيح وطنية واسعة ضد المرض على مستوى مختلف أنحاء البلاد كإجراء وقائي. انقطاع كامل للكهرباء بعد هجوم بالمسيّرات في السودان قمة أوروبية لحسم تمويل أوكرانيا بالأصول الروسية المجمدة الأسواق اليوم | ارتفاع أسعار النفط واستقرار الذهب والدولار",ar,2008,317,Unknown,Unknown,Unknown,Media,alaraby.co.uk,عثمان لحياني أعادت الجزائر فتح أسواق المواشي بعد تلقيح 70% من مجموع المواشي في البلاد، إثر ما يقارب الشهر على قرار إغلاقها ومنع نقل المواشي والأغنام، في أعقاب ظهور بؤر الحمى القلاعية التي تصيب الماشية في بعض ولايات البلاد.,"عثمان لحياني أعادت الجزائر فتح أسواق المواشي بعد تلقيح 70% من مجموع المواشي في البلاد، إثر ما يقارب الشهر على قرار إغلاقها ومنع نقل المواشي والأغنام، في أعقاب ظهور بؤر الحمى القلاعية التي تصيب الماشية في بعض ولايات البلاد. وقد أعلن وزير الزراعة يوسف شرفة خلال زياراته مزارع في ولاية سطيف شرقي الجزائر، اليوم الخميس، أن ""المصالح المختصة كسبت رهان مكافحة مرض الحمى القلاعية الذي ظهر مؤخرا بتلقيح أكثر من 70% منالثروة الحيوانيةالمعنية بهذه العملية في ظرف وجيز""، مشيرا إلى أن ""عملية التلقيح مستمرة في إطار حماية الثروة الحيوانية"".","عثمان لحياني أعادت الجزائر فتح أسواق المواشي بعد تلقيح 70% من مجموع المواشي في البلاد، إثر ما يقارب الشهر على قرار إغلاقها ومنع نقل المواشي والأغنام، في أعقاب ظهور بؤر الحمى القلاعية التي تصيب الماشية في بعض ولايات البلاد. وسمح حكام الولايات، بالتنسيق مع وزارةالزراعة، بإعادة فتح الأسواق المحلية لبيع المواشي، ورفع الإجراءات التي كانت تمنع نقل المواشي بين المدن والبلدات، بما سيسمح للموالين ومربي المواشي والأبقار بحرية نقل مواشيهم وبيعها. وحثت السلطات المزارعين على إجراء تطهير جميع المركبات التي تستخدم لنقل المواشي والأبقار، والاستمرار في عملية التلقيح واستكمالها، كما دعت مصالح البلديات إلى تطهير الأسواق ومحيطها. وقد أعلن وزير الزراعة يوسف شرفة خلال زياراته مزارع في ولاية سطيف شرقي الجزائر، اليوم الخميس، أن ""المصالح المختصة كسبت رهان مكافحة مرض الحمى القلاعية الذي ظهر مؤخرا بتلقيح أكثر من 70% منالثروة الحيوانيةالمعنية بهذه العملية في ظرف وجيز""، مشيرا إلى أن ""عملية التلقيح مستمرة في إطار حماية الثروة الحيوانية"".",
code665,https://www.alwihdainfo.com/Tchad-dans-le-Kamen-le-gouverneur-lance-la-campagne-de-vaccination-contre-la-peste-bovine_a129661.html,"Tchad : dans le Kamen, le gouverneur lance la campagne de vaccination contre la peste bovine",,unknown,0,0,Unknown,Tchad,Bovine,Media,alwihdainfo.com,,,,
code666,https://tchadinfos.com/la-campagne-de-vaccination-conjointe-de-betail-contre-la-peripneumonie-contagieuse-bovine-et-la-peste-des-petits-ruminants-lancee-dans-le-mayo-kebbi-ouest/,La campagne de vaccination conjointe de bétail contre la péripneumonie contagieuse bovine et la peste des petits ruminants lancée dans le Mayo-Kebbi ouest,"Accueil»La campagne de vaccination conjointe de bétail contre la péripneumonie contagieuse bovine et la peste des petits ruminants lancée dans le Mayo-Kebbi ouest Le ferrick Soudjé, a abrité le 24 janvier 2024, la cérémonie de lancement de la campagne de vaccination conjointe de bétail contre la péripneumonie contagieuse bovine (PPCB) et la peste des petits ruminants (PPR) dans le Mayo-Kebbi ouest. Une cérémonie présidée par le secrétaire général de ladite province, Valentin Moassengar, en présence de plusieurs autorités et des éleveurs nomades sédentarisés. Dans son intervention, le délégué provincial de l’Elevage, Dr Laurent Haïdi Dadass, a fait savoir que cette campagne conjointe permet de contrôler la PPCB maladie à travers sa réduction progressive et son éradication envisagée  à l’horizon 2030. Selon lui, la vaccination contre la PPCB est obligatoire et ne coûte que 100 FCFA par tête tandis que celle de la PPR est gratuite. Le délégué exhorte les autorités administratives, traditionnelles, les organisations des pasteurs, et aussi les partenaires de les aider à atteindre les objectifs en présentant tous les animaux aux centres de vaccination. Le délégué d’indiquer que les équipes de vaccinateurs seront déployées dans toute la province afin de vacciner tous les animaux. Lançant officiellement la campagne, le secrétaire général de la province du Mayo-Kebbi ouest, Valentin Moassengar, a souligné que l’objectif global du gouvernement est de parvenir à améliorer le taux de la couverture vaccinale et réduire le taux de prévalence de la PPCB et la PPR au Tchad. À cet effet, pour cette campagne conjointe, plus de 1 500 000 têtes de bétail recevront le vaccin. Valentin Moassengar invite toute les communautés des éleveurs à présenter la totalité de leurs bétails dans les centres de vaccination. Votre adresse e-mail ne sera pas publiée.Les champs obligatoires sont indiqués avec* Commentaire* Nom* E-mail* Enregistrer mon nom, mon e-mail et mon site dans le navigateur pour mon prochain commentaire.  Ne ratez rien de notre actualité et recevez dans votre boîte email les dernières nouvelles de Tchadinfos !  J'ai lu et j'accepte les conditions d'utilisation",fr,2183,336,25-01-2024,Tchad,Peste Des Petits Ruminants,Media,tchadinfos.com,,"Accueil»La campagne de vaccination conjointe de bétail contre la péripneumonie contagieuse bovine et la peste des petits ruminants lancée dans le Mayo-Kebbi ouest Le ferrick Soudjé, a abrité le 24 janvier 2024, la cérémonie de lancement de la campagne de vaccination conjointe de bétail contre la péripneumonie contagieuse bovine (PPCB) et la peste des petits ruminants (PPR) dans le Mayo-Kebbi ouest.","Accueil»La campagne de vaccination conjointe de bétail contre la péripneumonie contagieuse bovine et la peste des petits ruminants lancée dans le Mayo-Kebbi ouest Le ferrick Soudjé, a abrité le 24 janvier 2024, la cérémonie de lancement de la campagne de vaccination conjointe de bétail contre la péripneumonie contagieuse bovine (PPCB) et la peste des petits ruminants (PPR) dans le Mayo-Kebbi ouest. Le délégué exhorte les autorités administratives, traditionnelles, les organisations des pasteurs, et aussi les partenaires de les aider à atteindre les objectifs en présentant tous les animaux aux centres de vaccination. Lançant officiellement la campagne, le secrétaire général de la province du Mayo-Kebbi ouest, Valentin Moassengar, a souligné que l’objectif global du gouvernement est de parvenir à améliorer le taux de la couverture vaccinale et réduire le taux de prévalence de la PPCB et la PPR au Tchad.","Accueil, Commentaire, Dadass, Dans, Dr, Elevage, Enregistrer, FCFA, Kebbi, La, Laurent, Le, Les, Mayo, Moassengar, Ne, Nom, PPCB, PPR, Selon, Tchad, Tchadinfos, Une, Valentin, Votre"
code667,https://www.14news.com/2024/01/25/bird-flu-detected-turkey-farm-daviess-county-officials-say/,"Bird flu detected at turkey farm in Daviess County, officials say","DAVIESS CO., Ind. (WFIE) - The Indiana Board of Animal Health says a commercial turkey farm in Daviess County has tested positive for highly pathogenic avian influenza. According to a release, the flock of 13,071 birds is under quarantine. Officials says this marks the first positive commercial flock in Indiana in more than a year. Indiana’s last case of HPAI was May 5, 2023 in a non-commercial flock in Posey County. For updates on Indiana’s status, you can visit the board of animal health’swebsite. Copyright 2024 WFIE. All rights reserved.",en,546,90,25-01-2024,Unknown,Influenza,Media,14news.com,(WFIE) - The Indiana Board of Animal Health says a commercial turkey farm in Daviess County has tested positive for highly pathogenic avian influenza. Officials says this marks the first positive commercial flock in Indiana in more than a year.,"DAVIESS CO., Ind. (WFIE) - The Indiana Board of Animal Health says a commercial turkey farm in Daviess County has tested positive for highly pathogenic avian influenza. According to a release, the flock of 13,071 birds is under quarantine. Officials says this marks the first positive commercial flock in Indiana in more than a year. Indiana’s last case of HPAI was May 5, 2023 in a non-commercial flock in Posey County. For updates on Indiana’s status, you can visit the board of animal health’swebsite. Copyright 2024 WFIE. All rights reserved.","DAVIESS CO., Ind. (WFIE) - The Indiana Board of Animal Health says a commercial turkey farm in Daviess County has tested positive for highly pathogenic avian influenza. According to a release, the flock of 13,071 birds is under quarantine. Officials says this marks the first positive commercial flock in Indiana in more than a year. Indiana’s last case of HPAI was May 5, 2023 in a non-commercial flock in Posey County. For updates on Indiana’s status, you can visit the board of animal health’swebsite. Copyright 2024 WFIE. All rights reserved.","According, All, Animal, Board, CO, Copyright, County, DAVIESS, Daviess, For, HPAI, Health, Ind, Indiana, May, Officials, Posey, The, WFIE"
code669,https://www.almasryalyoum.com/news/details/3085751,غدًا.. انطلاق الحملة القومية للتحصين ضد الجلد العقدي وجدري الأغنام في الشرقية,,unknown,0,0,26-01-2024,Unknown,Unknown,Media,almasryalyoum.com,,,,
code671,https://www.kenyanews.go.ke/government-confirms-rift-valley-fever-human-case/,Government confirms Rift Valley fever human case,"Kenya News Agency Information For Development The Ministry of Health has received a confirmed report of a Rift Valley Fever (RVF), human case, from Turbi, North Horr Sub-County, Marsabit County. Acting Director General for Health, Dr. Patrick Amoth, said that this marks the first reported human case in the country, adding that ongoing investigations aim to identify additional cases and assess the extent of the outbreak. “This outbreak is closely associated with the conclusion of El-Niño rains, leading to a surge in the mosquito population and an increased transmission of vector-borne diseases,” said Dr. Amoth in a circular to all County Directors of Health, through the Chief Executive Officer, Council of Governors, dated 24thJanuary 2024. Dr. Amoth has advised all counties to remain on high alert for the potential spread of RVF, given the reported increase in mosquito population nationwide and the movement of livestock. “Specifically, County Departments of Health should inform all healthcare workers about this alert, sensitize healthcare workers to RVF case definitions, to increase the index of suspicion, share case definitions with all health facilities and reporting units,” said Dr. Amoth. He also called on health officials to enhance disease surveillance and reporting at all levels, establish and/or enhance capacity for sample referral to National Public Health Laboratories (NPHLS) for confirmatory testing and activate County-level multisectoral coordination mechanisms using the One Health approach to guide preparedness and response efforts. “I would also like to encourage County Departments of Health, to develop RVF-specific preparedness and response plans, implement integrated vector control programs, and conduct public awareness campaigns about RVF,” said Dr. Amoth. He explained that preventive measures for RVF include using protective equipment such as gloves and protective gowns when assisting with animal births, discarding aborted/stillbirths or retained placentas, and disposing of carcasses, avoiding the handling and consumption of uninspected meat and using insecticide-treated bed nets to prevent mosquito bites. “I would like to advise all individuals experiencing a fever to report to the nearest health facility for assessment,” said Dr. Amoth. He highlighted that the Ministry of Health is working closely with the Directorate of Veterinary Services to monitor the situation and will update Kenyans accordingly. By Joseph Ng’ang’a You must belogged into post a comment. Kenya News Agency WhatsApp Channel FAQManagement StaffContact UsNational Values and Principles Ministry of Information, Communications and The Digital Economy (MICDE) Kenya Broadcasting Corporation MyGov Communication Authority of Kenya Kenya Yearbook Editorial Board Kenya Institute of Mass Communication Media Council of Kenya Office of the Data Protection Commissioner eCitizen – Gateway to All Government Services GHRIS – Self Portal  How to make payments to the Directorate of Information   Inside Kenya, September, 2025. Mawasiliano, November, 2025 County Focus, November, 2025. Sauti Ya Kericho, November, 2025. Maarifa, November, 2025. Ngao, October, 2025. The Eye, October, 2025. Nyota Ya Mashariki, July , 2025. Nyota Ya Magharibi, October, 2025. KNA Bulletin, September, 2025. Sauti Ya Gusii, November, 2025.  ",en,3343,482,Unknown,Unknown,Rage,Media,kenyanews.go.ke,,"Kenya News Agency WhatsApp Channel FAQManagement StaffContact UsNational Values and Principles Ministry of Information, Communications and The Digital Economy (MICDE) Kenya Broadcasting Corporation MyGov Communication Authority of Kenya Kenya Yearbook Editorial Board Kenya Institute of Mass Communication Media Council of Kenya Office of the Data Protection Commissioner eCitizen – Gateway to All Government Services GHRIS – Self Portal  How to make payments to the Directorate of Information   Inside Kenya, September, 2025.","He explained that preventive measures for RVF include using protective equipment such as gloves and protective gowns when assisting with animal births, discarding aborted/stillbirths or retained placentas, and disposing of carcasses, avoiding the handling and consumption of uninspected meat and using insecticide-treated bed nets to prevent mosquito bites. Kenya News Agency WhatsApp Channel FAQManagement StaffContact UsNational Values and Principles Ministry of Information, Communications and The Digital Economy (MICDE) Kenya Broadcasting Corporation MyGov Communication Authority of Kenya Kenya Yearbook Editorial Board Kenya Institute of Mass Communication Media Council of Kenya Office of the Data Protection Commissioner eCitizen – Gateway to All Government Services GHRIS – Self Portal  How to make payments to the Directorate of Information   Inside Kenya, September, 2025.","Acting, Agency, All, Amoth, Authority, Board, Broadcasting, Bulletin, By, Channel, Chief, Commissioner, Communication, Communications, Corporation, Council, County, Data, Departments, Development, Digital, Director, Directorate, Directors, Dr, Economy, Editorial, El, Executive, Eye, FAQManagement, Fever, Focus, For, GHRIS, Gateway, General, Government, Governors, Gusii, He, Health, Horr, How, Information, Inside, Institute, Joseph, July, KNA, Kenya, Kenyans, Kericho, Laboratories, MICDE, Maarifa"
code672,https://www.elbalad.news/6089101,بيطري الشرقية يحصن 651 ألف رأس ماشية ضد الحمى القلاعية والوادي المتصدع,أكد الدكتور ممدوح غراب محافظ الشرقية على ضرورة الاهتمام بالثروة الحيوانية وتوفير أوجه الدعم والرعاية البيطرية لوقايتها من الأمراض، والعمل على زيادة إنتاجيتها لتلبية احتياجات السوق المحلي ، مشدداً على ضرورة تكثيف حملات تحصين الماشية ومرور الفرق الطبية البيطرية على أصحاب المزارع والمربين بمختلف قرى و مراكز المحافظة للوقاية من مرضي الحمى القلاعية و حمى الوادي المتصدع للحفاظ على الثروة الحيوانية. وفى هذا الإطار أشار اللواء دكتور إبراهيم محمد متولي وكيل الوزارة مدير مديرية الطب البيطري إلى أنه في إطار الحملة القومية الثالثة للتحصين ضد مرضي الحمى القلاعية و حمى الوادي المتصدع التي بدأت أعمالها في ١٩ نوفمبر ٢٠٢٣م قامت المديرية عن طريق (١٨٠ ) لجنة خلال الأسبوع التاسع من الحملة بتحصين ( ٦٥١ ألف و ٧١٠) رأس ماشية، منها تحصين (٣٢٩ ألف و ١٧٤) رأس ماشية للوقاية من مرض الحمى القلاعية و ( ٣٢٢ ألف و ٥٣٦) رأس ماشية للوقاية من مرض حمى الوادي المتصدع وترقيم وتسجيل ( ١٥٦٤٩) رأس ماشية. وأشار إلى أن المديرية قامت بزيارات ميدانية للقرى بجميع مراكز و مدن المحافظة للتوعية الإرشادية عن أهمية التحصين ضد مرضي الحمى القلاعية و حمى الوادي المتصدع وتم عقد (٦١٠٢) ندوة و جولة إرشادية وتسيير سيارات إرشادية متنقلة بين القرى لتعريف المربين بالمرضين وأعراضهما ، ومدى خطورتهما على الثروة الحيوانية وأهمية التحصين بصورة دورية لتجنب إصابة الحيوانات بالمرضين وتقليل الخسائر الناتجة. وأضاف مدير مديرية الطب البيطري أن لجان التحصين باشرت عملها في المقار المعدة لها أو بالانتقال إلى المربين بمنازلهم للتحصين وترقيم الحيوانات ، مشيداً بإقبال المواطنين للحملة نظراً لزيادة الوعي البيطري لديهم بخطورة المرض والأهمية القصوى للتحصين وذلك لتحقيق أهداف الحملة القومية للحفاظ على الثروة الحيوانية بالمحافظة وزيادة إنتاجيتها. جميع الحقوق محفوظة لموقع صدى البلد  2025 ©  |,ar,1635,270,27-01-2024,Unknown,Unknown,Media,elbalad.news,,وفى هذا الإطار أشار اللواء دكتور إبراهيم محمد متولي وكيل الوزارة مدير مديرية الطب البيطري إلى أنه في إطار الحملة القومية الثالثة للتحصين ضد مرضي الحمى القلاعية و حمى الوادي المتصدع التي بدأت أعمالها في ١٩ نوفمبر ٢٠٢٣م قامت المديرية عن طريق (١٨٠ ) لجنة خلال الأسبوع التاسع من الحملة بتحصين ( ٦٥١ ألف و ٧١٠) رأس ماشية، منها تحصين (٣٢٩ ألف و ١٧٤) رأس ماشية للوقاية من مرض الحمى القلاعية و ( ٣٢٢ ألف و ٥٣٦) رأس ماشية للوقاية من مرض حمى الوادي المتصدع وترقيم وتسجيل ( ١٥٦٤٩) رأس ماشية.,وفى هذا الإطار أشار اللواء دكتور إبراهيم محمد متولي وكيل الوزارة مدير مديرية الطب البيطري إلى أنه في إطار الحملة القومية الثالثة للتحصين ضد مرضي الحمى القلاعية و حمى الوادي المتصدع التي بدأت أعمالها في ١٩ نوفمبر ٢٠٢٣م قامت المديرية عن طريق (١٨٠ ) لجنة خلال الأسبوع التاسع من الحملة بتحصين ( ٦٥١ ألف و ٧١٠) رأس ماشية، منها تحصين (٣٢٩ ألف و ١٧٤) رأس ماشية للوقاية من مرض الحمى القلاعية و ( ٣٢٢ ألف و ٥٣٦) رأس ماشية للوقاية من مرض حمى الوادي المتصدع وترقيم وتسجيل ( ١٥٦٤٩) رأس ماشية.,
code673,https://www.babnet.net/cadredetail-281179.asp#google_vignette,بن عروس : خيمة بيطرية بالمروج للتلقيح ضد داء الكلب وللتحسيس بخطورة الإصابة بهذا المرض و طرق التوقي منه,0de0commentaires pour l'article  281179 MSM IT © 2000 - 2025 -Votre pub sur Babnet Téléphone Email Charte de Confidentialité,fr,124,19,Unknown,Unknown,Unknown,Media,babnet.net,0de0commentaires pour l'article  281179 MSM IT © 2000 - 2025 -Votre pub sur Babnet Téléphone Email Charte de Confidentialité,0de0commentaires pour l'article  281179 MSM IT © 2000 - 2025 -Votre pub sur Babnet Téléphone Email Charte de Confidentialité,0de0commentaires pour l'article  281179 MSM IT © 2000 - 2025 -Votre pub sur Babnet Téléphone Email Charte de Confidentialité,"Babnet, Charte, Email, IT, MSM, Votre"
