Code,URL,Titre,Contenu,Langue,Nb Caractères,Nb Mots,Date Publication,Lieu,Maladie,Source,Domaine,Résumé 50,Résumé 100,Résumé 150,Entités
code681,https://www.thehindu.com/sci-tech/science/outbreak-of-western-equine-encephalitis-virus-in-argentina/article67780160.ece,Outbreak of Western Equine Encephalitis Virus in ArgentinaPremium,"November 2, 2025e-Paper The View From IndiaLooking at World Affairs from the Indian perspective. First Day First ShowNews and reviews from the world of cinema and streaming. Today's CacheYour download of the top 5 technology stories of the day. Science For AllThe weekly newsletter from science writers takes the jargon out of science and puts the fun in! Data PointDecoding the headlines with facts, figures, and numbers Health MattersRamya Kannan writes to you on getting to good health, and staying there The Hindu On BooksBooks of the week, reviews, excerpts, new titles and features. November 2, 2025e-Paper Published- January 27, 2024 09:06 pm IST The culprit:The primary mode of transmission of the infection to humans is through mosquitoes, which act as vectors for the virus. 
                                          | Photo Credit: Getty/iStockPhoto On December 20, 2023, the International Health Regulations National Focal Point (IHR NFP) in Argentina alerted the Pan American Health Organization/World Health Organization (PAHO/WHO) of a human case of Western Equine Encephalitis Virus (WEEV) infection. The patient had a sudden onset fever and neurological features on November 19, 2023 and was later admitted to a provincial hospital, and discharged on close follow-up on December 20. The outbreak has grown to 21 confirmed new cases of the infection in Argentina and comes after more than two decades since the last case was reported in the country. The last cases of human infections in Argentina were reported in 1982, 1983, and an isolated event in 1996. The present outbreak also comes in the context of an ongoing outbreak in horses in Argentina and Uruguay. Multiple outbreaks and human cases of Westen Equine Encephalitis have been reported in the past from the U.S. and Canada and over 3,000 cases of infection have been reported over these years. Western Equine Encephalitis is a mosquito-borne infection caused by the Western Equine Encephalitis Virus (WEEV), which belongs to the Togaviridae family of viruses. The virus has an approximately 11.5 kilobases long single-stranded RNA genome and is a recombinant of the eastern equine encephalitis virus (EEEV) and a Sindbis-like virus. Passerine birds are thought to be the reservoir and equine species as intermediate hosts. The primary mode of transmission of the infection to humans is through mosquitoes which act as vectors for the virus. While most of the infections are asymptomatic, the infection may lead to severe consequences in rare cases. An estimated 4-5% of cases may manifest as infection/inflammation of the brain, resulting in neurological symptoms and sequelae of disease. With no specific antiviral treatment, symptomatic care is crucial, especially for neurologic symptoms. Since December 2023, there have been 374 laboratory-confirmed cases of WEEV infections in animals in Argentina and Uruguay, and an additional 21 human cases in Argentina. In Argentina, there have been 1,258 cases of infections in animals in 15 provinces, with the province of Buenos Aires having the highest number of cases. In Uruguay, there have been 56 cases of Western Equine Encephalitis Virus in equines, with no reported human infections. After the detection of the initial case of the ongoing outbreak in Argentina reported in December 2023, a total of 91 additional suspected cases have since been tested across 11 provinces in the country out of which 21 have been confirmed positive for the virus. Of these cases, eight individuals needed intensive care unit care, 13 required general hospitalization and one case resulted in a fatality. In the cases for which exposure history is available, three individuals were veterinarians, two were construction workers, and two reported engaging in outdoor recreational activities. While PAHO/WHO has issued an alert on the risk of the spread of WEE in the Americas, enhanced surveillance and detection of infections will be crucial for preventing the spread of the virus. Following a One Health approach is essential for the control of the virus. Environmental modifications, vector control, and vaccination for equines in affected and high-risk regions to curb the potential spread of the virus. (Bani Jolly is a senior scientist at Karkinos Healthcare and Vinod Scaria is a senior consultant at Vishwanath Cancer Care Foundation) Published- January 27, 2024 09:06 pm IST Copyright© 2025, THG PUBLISHING PVT LTD. or its affiliated companies. All rights reserved. BACK TO TOP Terms & conditions|Institutional Subscriber Comments have to be in English, and in full sentences. They cannot be abusive or personal. Please abide by ourcommunity guidelinesfor posting your comments. We have migrated to a new commenting platform. If you are already a registered user of The Hindu and logged in, you may continue to engage with our articles. If you do not have an account please register and login to post comments. Users can access their older comments by logging into their accounts on Vuukle.",en,5012,783,27-01-2024,Unknown,Unknown,Media,thehindu.com,"After the detection of the initial case of the ongoing outbreak in Argentina reported in December 2023, a total of 91 additional suspected cases have since been tested across 11 provinces in the country out of which 21 have been confirmed positive for the virus.","After the detection of the initial case of the ongoing outbreak in Argentina reported in December 2023, a total of 91 additional suspected cases have since been tested across 11 provinces in the country out of which 21 have been confirmed positive for the virus.","November 2, 2025e-Paper Published- January 27, 2024 09:06 pm IST The culprit:The primary mode of transmission of the infection to humans is through mosquitoes, which act as vectors for the virus. 
                                          | Photo Credit: Getty/iStockPhoto On December 20, 2023, the International Health Regulations National Focal Point (IHR NFP) in Argentina alerted the Pan American Health Organization/World Health Organization (PAHO/WHO) of a human case of Western Equine Encephalitis Virus (WEEV) infection. After the detection of the initial case of the ongoing outbreak in Argentina reported in December 2023, a total of 91 additional suspected cases have since been tested across 11 provinces in the country out of which 21 have been confirmed positive for the virus. While PAHO/WHO has issued an alert on the risk of the spread of WEE in the Americas, enhanced surveillance and detection of infections will be crucial for preventing the spread of the virus.","Affairs, After, Aires, All, AllThe, American, Americas, An, Argentina, BACK, Bani, BooksBooks, Buenos, CacheYour, Canada, Cancer, Care, Comments, Copyright, Credit, Data, Day, December, EEEV, Encephalitis, English, Environmental, Equine, First, Focal, Following, For, Foundation, From, Getty, Health, Healthcare, Hindu, IHR, IST, If, In, IndiaLooking, Indian, Institutional, International, January, Jolly, Kannan, Karkinos, LTD, MattersRamya, Multiple, NFP, National, November, Of, On, One, Organizat"
code684,https://elwatan-dz.com/des-cas-signales-a-aghbalou-et-bordj-okhris-bouira-alerte-a-la-brucellose-humaine,Des cas signalés à Aghbalou et Bordj Okhris (Bouira) : Alerte à la brucellose humaine,"Des cas de brucellose humaine, une maladie très contagieuse, ont été enregistrés, avant-hier, dans les communes d’Aghbalou et de Bordj Okhris, respectivement situées au nord-est et à l’extrême sud de Bouira, a-t-on appris de source sanitaire. En effet, plusieurs personnes d’une même famille ont été atteintes de brucellose. Elles ont été transférées en urgence à l’hôpital, a-t-on souligné de même source, précisant que toutes les mesures nécessaires ont été prises par le personnel médical. Sans préciser le bilan précis sur le nombre des contaminations, l’inspectrice vétérinaire à la direction des services agricoles (DSA), Mme Benbelkacem Djamila, qui a souligné que l’alerte a été donnée par le service de prévention de la santé, a précisé que les personnes contaminées sont hospitalisées pour avoir consommé du lait de caprin. «Le cheptel est localisé et toutes les mesures indispensables ont été prises», a rassuré Mme Benbelkacem. Affectant pour la plupart les bovins, ovins et les caprins, la brucellose touche essentiellement les êtres humains consommant du lait cru et autres fromages non pasteurisés. En 2023, les services de la Direction de la santé publique (DSP) de la wilaya de Bouira avaient enregistré plus d’une soixantaine de cas de brucellose humaine. Tendances de la Semaine Catégories Populaires Le quotidien El Watan a été lancé le 8 octobre 1990, dans le sillage des réformes politiques, par vingt journalistes regroupés dans la SPA El Watan. Premier journal indépendant du matin, d’expression française, à être édité en Algérie, il a basé sa ligne éditoriale sur un traitement objectif de l’information, en développant des analyses pertinentes, une vérification rigoureuse des informations publiées et un souci constant d’ouverture à l’ensemble des sensibilités politiques du pays, notamment celle de l’opposition démocratique. ©El Watan All Rights Reserved.",fr,1885,285,30-01-2024,Algérie,Brucellose,Media,elwatan-dz.com,,"Sans préciser le bilan précis sur le nombre des contaminations, l’inspectrice vétérinaire à la direction des services agricoles (DSA), Mme Benbelkacem Djamila, qui a souligné que l’alerte a été donnée par le service de prévention de la santé, a précisé que les personnes contaminées sont hospitalisées pour avoir consommé du lait de caprin. En 2023, les services de la Direction de la santé publique (DSP) de la wilaya de Bouira avaient enregistré plus d’une soixantaine de cas de brucellose humaine.","Des cas de brucellose humaine, une maladie très contagieuse, ont été enregistrés, avant-hier, dans les communes d’Aghbalou et de Bordj Okhris, respectivement situées au nord-est et à l’extrême sud de Bouira, a-t-on appris de source sanitaire. Sans préciser le bilan précis sur le nombre des contaminations, l’inspectrice vétérinaire à la direction des services agricoles (DSA), Mme Benbelkacem Djamila, qui a souligné que l’alerte a été donnée par le service de prévention de la santé, a précisé que les personnes contaminées sont hospitalisées pour avoir consommé du lait de caprin. En 2023, les services de la Direction de la santé publique (DSP) de la wilaya de Bouira avaient enregistré plus d’une soixantaine de cas de brucellose humaine.","Affectant, Aghbalou, All, Benbelkacem, Bordj, Bouira, DSA, DSP, Des, Direction, Djamila, El, Elles, En, Le, Mme, Okhris, Populaires, Premier, Reserved, Rights, SPA, Sans, Semaine, Tendances, Watan"
code685,https://rosaelyoussef.com/1156194/%D8%A7%D9%84%D8%B2%D8%B1%D8%A7%D8%B9%D8%A9-%D8%AA%D8%AD%D8%B5%D9%8A%D9%86-67-%D8%B1%D8%A3%D8%B3-%D9%85%D8%A7%D8%B4%D9%8A%D8%A9-%D8%B6%D8%AF-%D8%A7%D9%84%D8%A3%D9%85%D8%B1%D8%A7%D8%B6-%D8%A8%D9%85%D8%AE%D8%AA%D9%84%D9%81-%D8%A7%D9%84%D9%85%D8%AD%D8%A7%D9%81%D8%B8%D8%A7%D8%AA,الزراعة: تحصين 6.7 رأس ماشية ضد الأمراض بمختلف المحافظات,"أعلن  الدكتور إيهاب صابر رئيس الهيئة العامة للخدمات البيطرية بوزارة الزراعة، عن انتهاء الحملة القومية الثالثة لتحصين المواشي ضد مرض الحمى القلاعية وحمى الوادي المتصدع للحفاظ على الثروة الحيوانية من الأوبئة بجميع محافظات الجمهورية، من تحصين حوالي 3 مليون و585 ألف و631 رأس ماشية من الأبقار والجاموس والأغنام والماعز.وأوضح ""صابر"" أنه تم تحصين هذه الحيوانات ضد مرض الحمى القلاعية منذ بداية الحملة في 19 نوفمبر الماضي وحتى نهايتها في 15 يناير الجاري، مشيرا إلى أنه تم تحصين حوالي 3 مليون و183 ألف و795 رأس ماشية ضد مرض حمى الوادي المتصدع من الأبقار والجاموس والأغنام والماعز والجمال.وأضاف  رئيس هيئة الخدمات البيطرية أن الحملات القومية مستمرة للحفاظ على الثروة الحيوانية من الأوبئة طوال العام هذا بالإضافة إلى مشاركة الهيئة العامة للخدمات البيطرية في القوافل البيطرية المجانية مع معاهد مركز البحوث الزراعية المعنية لعلاج مواشي صغار المربين في كل قرى ونجوع مصر. أعلن  الدكتور إيهاب صابر رئيس الهيئة العامة للخدمات البيطرية بوزارة الزراعة، عن انتهاء الحملة القومية الثالثة لتحصين المواشي ضد مرض الحمى القلاعية وحمى الوادي المتصدع للحفاظ على الثروة الحيوانية من الأوبئة بجميع محافظات الجمهورية، من تحصين حوالي 3 مليون و585 ألف و631 رأس ماشية من الأبقار والجاموس والأغنام والماعز.   وأوضح ""صابر"" أنه تم تحصين هذه الحيوانات ضد مرض الحمى القلاعية منذ بداية الحملة في 19 نوفمبر الماضي وحتى نهايتها في 15 يناير الجاري، مشيرا إلى أنه تم تحصين حوالي 3 مليون و183 ألف و795 رأس ماشية ضد مرض حمى الوادي المتصدع من الأبقار والجاموس والأغنام والماعز والجمال.  وأضاف  رئيس هيئة الخدمات البيطرية أن الحملات القومية مستمرة للحفاظ على الثروة الحيوانية من الأوبئة طوال العام هذا بالإضافة إلى مشاركة الهيئة العامة للخدمات البيطرية في القوافل البيطرية المجانية مع معاهد مركز البحوث الزراعية المعنية لعلاج مواشي صغار المربين في كل قرى ونجوع مصر.  شهدت الساعات الأخيرة تطورا لافتا في ملف انتقال يوسف بلعمري جناح الرجاء المغربي إلى النادي الأهلي بعدما طر  انقسم القادة الأوروبيون بشكل حاد بسبب خلافات حول مسألة مصادرة الأصول الروسية تتجه أنظار جماهير كرة القدم العربية مساء اليوم الخميس 18 ديسمبر 2025 إلى أكد نائب وزير الخارجية الروسي دميتري ليوبينسكي أن روسيا منفتحة على الحوار القائم على يترقب عشاق الكرة العربية مواجهة خليجية خاصة اليوم الخميس 18 ديسمبر 2025 حين يلتقي يكتب يبدو أن رئيس الوزراء الإسرائيلى بنيامين نتنياهو لم يتخل عن حيل وصفات التسويق التي امتهنها فى تجارة الأثا",ar,2253,370,30-01-2024,Unknown,Unknown,Media,rosaelyoussef.com,,,"أعلن  الدكتور إيهاب صابر رئيس الهيئة العامة للخدمات البيطرية بوزارة الزراعة، عن انتهاء الحملة القومية الثالثة لتحصين المواشي ضد مرض الحمى القلاعية وحمى الوادي المتصدع للحفاظ على الثروة الحيوانية من الأوبئة بجميع محافظات الجمهورية، من تحصين حوالي 3 مليون و585 ألف و631 رأس ماشية من الأبقار والجاموس والأغنام والماعز.وأوضح ""صابر"" أنه تم تحصين هذه الحيوانات ضد مرض الحمى القلاعية منذ بداية الحملة في 19 نوفمبر الماضي وحتى نهايتها في 15 يناير الجاري، مشيرا إلى أنه تم تحصين حوالي 3 مليون و183 ألف و795 رأس ماشية ضد مرض حمى الوادي المتصدع من الأبقار والجاموس والأغنام والماعز والجمال.وأضاف  رئيس هيئة الخدمات البيطرية أن الحملات القومية مستمرة للحفاظ على الثروة الحيوانية من الأوبئة طوال العام هذا بالإضافة إلى مشاركة الهيئة العامة للخدمات البيطرية في القوافل البيطرية المجانية مع معاهد مركز البحوث الزراعية المعنية لعلاج مواشي صغار المربين في كل قرى ونجوع مصر.",
code686,https://lecourrier.vn/largentine-confirme-cinq-morts-dus-a-lencephalite-equine/1225789.html,Lecourrier.vn,"Cinq personnes sont mortes du virus de l'encéphalite équine occidentale en Argentine, parmi 39 cas d'infection enregistrés dans cinq des 24 provinces du pays d'Amérique du Sud, a déclaré dimanche 28 janvier le ministère argentin de la Santé. >> Argentine : décélération de l'inflation en juin, +50,7% depuis le début de  l'année >> Argentine : taux d'inflation de 12,4% en août, pire résultat mensuel depuis 21 ans >> Le FMI annonce un versement de 4,7 milliards d'USD à l'Argentine Les cas se sont concentrés principalement dans la région centrale du pays, avec 38 des 39 infections enregistrées dans les provinces de Buenos Aires, Santa Fe, Entre Rios et Cordoba, et un cas dans la province nord de Santiago del Estero. Tous les cas ont besoin d'hospitalisation. Les patients ont en moyenne 55 ans, le plus âgé ayant 81 ans et le plus jeune neuf mois, a indiqué le ministère. Le virus est essentiellement transmis dans les zones rurales par la piqûre de moustiques infectés. Chez l'homme, la plupart des cas sont asymptomatiques ou présentent des symptômes légers tels que de la fièvre, de la fatigue, des douleurs musculaires et un malaise général. Xinhua/VNA/CVN Copyright : Le Courrier du Vietnam, tous droits réservés, Agence Vietnamienne
                    d'Information (AVI) Rédactrice en chef : Nguyễn Hồng Nga Adresse : 79, rue Ly Thuong Kiêt, Hanoï, Vietnam Permis de publication : 25/GP-BTTTT Tél : (+84) 24 38 25 20 96 E-mail : courrier@vnanet.vn, courrier.cvn@gmail.com",fr,1486,239,Unknown,Unknown,Unknown,Media,lecourrier.vn,,">> Argentine : décélération de l'inflation en juin, +50,7% depuis le début de  l'année >> Argentine : taux d'inflation de 12,4% en août, pire résultat mensuel depuis 21 ans >> Le FMI annonce un versement de 4,7 milliards d'USD à l'Argentine Les cas se sont concentrés principalement dans la région centrale du pays, avec 38 des 39 infections enregistrées dans les provinces de Buenos Aires, Santa Fe, Entre Rios et Cordoba, et un cas dans la province nord de Santiago del Estero.",">> Argentine : décélération de l'inflation en juin, +50,7% depuis le début de  l'année >> Argentine : taux d'inflation de 12,4% en août, pire résultat mensuel depuis 21 ans >> Le FMI annonce un versement de 4,7 milliards d'USD à l'Argentine Les cas se sont concentrés principalement dans la région centrale du pays, avec 38 des 39 infections enregistrées dans les provinces de Buenos Aires, Santa Fe, Entre Rios et Cordoba, et un cas dans la province nord de Santiago del Estero. Xinhua/VNA/CVN Copyright : Le Courrier du Vietnam, tous droits réservés, Agence Vietnamienne
                    d'Information (AVI) Rédactrice en chef : Nguyễn Hồng Nga Adresse : 79, rue Ly Thuong Kiêt, Hanoï, Vietnam Permis de publication : 25/GP-BTTTT Tél : (+84) 24 38 25 20 96 E-mail : courrier@vnanet.vn, courrier.cvn@gmail.com","AVI, Adresse, Agence, Aires, Argentine, BTTTT, Buenos, CVN, Chez, Cinq, Copyright, Cordoba, Courrier, Entre, Estero, FMI, Fe, GP, Information, Le, Les, Ly, Nga, Permis, Rios, Santa, Santiago, Sud, Thuong, Tous, USD, VNA, Vietnam, Vietnamienne, Xinhua"
code687,https://www.alquds.co.uk/%D8%A7%D9%84%D8%B5%D9%8A%D9%86-%D8%AA%D8%AD%D8%B8%D8%B1-%D8%A7%D8%B3%D8%AA%D9%8A%D8%B1%D8%A7%D8%AF-%D8%A7%D9%84%D8%AD%D9%8A%D9%88%D8%A7%D9%86%D8%A7%D8%AA-%D8%A7%D9%84%D9%85%D8%AC%D8%AA%D8%B1%D8%A9/,الصين تحظر استيراد الحيوانات المجترة ومنتجاتها من العراق بسبب مرض اللسان الأزرق, بكين:  قالت الصين إنها حظرت الاستيراد المباشر وغير المباشر للحيوانات المجترة ومنتجاتها من العراق بسبب تفشي مرض اللسان الأزرق.جاء ذلك في إعلان للإدارة العامة للجمارك الصينية بتاريخ 26 يناير/ كانون الثاني.(رويترز) بكين:  قالت الصين إنها حظرت الاستيراد المباشر وغير المباشر للحيوانات المجترة ومنتجاتها من العراق بسبب تفشي مرض اللسان الأزرق. جاء ذلك في إعلان للإدارة العامة للجمارك الصينية بتاريخ 26 يناير/ كانون الثاني. (رويترز) لن يتم نشر عنوان بريدك الإلكتروني.الحقول الإلزامية مشار إليها بـ* التعليق* الاسم* البريد الإلكتروني* الموقع الإلكتروني   Δ   جميع الحقوق محفوظة © 2025 صحيفة القدس العربي,ar,596,89,31-01-2024,Unknown,Unknown,Media,alquds.co.uk, بكين:  قالت الصين إنها حظرت الاستيراد المباشر وغير المباشر للحيوانات المجترة ومنتجاتها من العراق بسبب تفشي مرض اللسان الأزرق.جاء ذلك في إعلان للإدارة العامة للجمارك الصينية بتاريخ 26 يناير/ كانون الثاني.(رويترز) بكين:  قالت الصين إنها حظرت الاستيراد المباشر وغير المباشر للحيوانات المجترة ومنتجاتها من العراق بسبب تفشي مرض اللسان الأزرق., بكين:  قالت الصين إنها حظرت الاستيراد المباشر وغير المباشر للحيوانات المجترة ومنتجاتها من العراق بسبب تفشي مرض اللسان الأزرق.جاء ذلك في إعلان للإدارة العامة للجمارك الصينية بتاريخ 26 يناير/ كانون الثاني.(رويترز) بكين:  قالت الصين إنها حظرت الاستيراد المباشر وغير المباشر للحيوانات المجترة ومنتجاتها من العراق بسبب تفشي مرض اللسان الأزرق. جاء ذلك في إعلان للإدارة العامة للجمارك الصينية بتاريخ 26 يناير/ كانون الثاني. (رويترز) لن يتم نشر عنوان بريدك الإلكتروني.الحقول الإلزامية مشار إليها بـ* التعليق* الاسم* البريد الإلكتروني* الموقع الإلكتروني   Δ   جميع الحقوق محفوظة © 2025 صحيفة القدس العربي, بكين:  قالت الصين إنها حظرت الاستيراد المباشر وغير المباشر للحيوانات المجترة ومنتجاتها من العراق بسبب تفشي مرض اللسان الأزرق.جاء ذلك في إعلان للإدارة العامة للجمارك الصينية بتاريخ 26 يناير/ كانون الثاني.(رويترز) بكين:  قالت الصين إنها حظرت الاستيراد المباشر وغير المباشر للحيوانات المجترة ومنتجاتها من العراق بسبب تفشي مرض اللسان الأزرق. جاء ذلك في إعلان للإدارة العامة للجمارك الصينية بتاريخ 26 يناير/ كانون الثاني. (رويترز) لن يتم نشر عنوان بريدك الإلكتروني.الحقول الإلزامية مشار إليها بـ* التعليق* الاسم* البريد الإلكتروني* الموقع الإلكتروني   Δ   جميع الحقوق محفوظة © 2025 صحيفة القدس العربي,
