Code,URL,Titre,Contenu,Langue,Nb Caractères,Nb Mots,Date Publication,Lieu,Maladie,Source,Domaine,Résumé 50,Résumé 100,Résumé 150,Entités
code651,https://www.lechasseurfrancais.com/chasse/attention-alerte-a-la-maladie-daujeszky-dans-le-doubs-88359.html,Attention : alerte à la maladie d’Aujeszky dans le Doubs,"Un cas de chien contaminé par Aujeszky vient d’être signalé dans le Doubs C’est la clinique vétérinaire de Pirey dans le Doubs qui informe qu’un cas de maladie d’Aujeszky a été diagnostiqué sur un chien de chasse récemment. Un cas a été signalé en Haute Saône, un chien a été contaminé lors d'une chasse dans le secteur de Luxeuil les Bains. Il se pourrait que ce soit ce chien qui a été soigné par le cabinet vétérinaire du Doubs.  Ce matin lafédération départementale des chasseurs du Doubsa relayé une information d’une clinique vétérinaire de Pirey. Cette dernière précise «  Nous tenons à vous informer qu’un cas de maladie d’Aujeszky a été diagnostiqué sur un chien de chasse à la clinique récemment ».  Amis chasseurs, soyez prudent. Cette année encore la maladie d’Aujeszky a frappé dans plusieurs départements :Dordogne,Haute Marne,Essonne… En attendant qu’un vaccin disponible soit trouvé pour les chiens, il est bon de rappeler quelques conseils simples : Rappel : Si cette maladie fait si peur c’est qu’elle est presque toujours fatale. Le chien contaminé meure dans les 24 à 48h. La maladie d’Aujeszky dite pseudo rage provoque chez les carnivores une encéphalite mortelle à 100 % (comme la rage). Ses symptômes : des chiens apathiques qui se grattent la face jusqu’ à s’infliger d’importantes lésions. Ils tombent ensuite dans le coma et meurent. Ils se contaminent en mangeant où mordant des porc ou sangliers contaminés et ne peuvent pas transmettre eux-mêmes la maladie.  Votre adresse de messagerie ne sera pas publiée.Les champs obligatoires sont indiqués avec* ",fr,1581,257,19-01-2024,Unknown,Rage,Media,lechasseurfrancais.com,Un cas de chien contaminé par Aujeszky vient d’être signalé dans le Doubs C’est la clinique vétérinaire de Pirey dans le Doubs qui informe qu’un cas de maladie d’Aujeszky a été diagnostiqué sur un chien de chasse récemment.,"Un cas de chien contaminé par Aujeszky vient d’être signalé dans le Doubs C’est la clinique vétérinaire de Pirey dans le Doubs qui informe qu’un cas de maladie d’Aujeszky a été diagnostiqué sur un chien de chasse récemment. Cette année encore la maladie d’Aujeszky a frappé dans plusieurs départements :Dordogne,Haute Marne,Essonne… En attendant qu’un vaccin disponible soit trouvé pour les chiens, il est bon de rappeler quelques conseils simples : Rappel : Si cette maladie fait si peur c’est qu’elle est presque toujours fatale.","Un cas de chien contaminé par Aujeszky vient d’être signalé dans le Doubs C’est la clinique vétérinaire de Pirey dans le Doubs qui informe qu’un cas de maladie d’Aujeszky a été diagnostiqué sur un chien de chasse récemment. Un cas a été signalé en Haute Saône, un chien a été contaminé lors d'une chasse dans le secteur de Luxeuil les Bains. Cette dernière précise «  Nous tenons à vous informer qu’un cas de maladie d’Aujeszky a été diagnostiqué sur un chien de chasse à la clinique récemment ». Cette année encore la maladie d’Aujeszky a frappé dans plusieurs départements :Dordogne,Haute Marne,Essonne… En attendant qu’un vaccin disponible soit trouvé pour les chiens, il est bon de rappeler quelques conseils simples : Rappel : Si cette maladie fait si peur c’est qu’elle est presque toujours fatale.","Amis, Aujeszky, Bains, Ce, Cette, Dordogne, Doubs, Doubsa, En, Essonne, Haute, Il, Ils, La, Le, Les, Luxeuil, Marne, Nous, Pirey, Rappel, Ses, Si, Un, Votre"
code652,https://www.eldjoumhouria.dz/article/21583/, elDjoumhouria :  الجمهورية ,الجمهورية  © 2022™ طور من طرفMeDⱭeV,ar,35,6,Unknown,Unknown,Unknown,Media,eldjoumhouria.dz,الجمهورية  © 2022™ طور من طرفMeDⱭeV,الجمهورية  © 2022™ طور من طرفMeDⱭeV,الجمهورية  © 2022™ طور من طرفMeDⱭeV,
code653,https://tchadinfos.com/salamat-debut-de-la-campagne-de-vaccination-conjointe-de-betail-contre-la-peripneumonie-contagieuse-bovine-et-la-peste-des-petits-ruminants/#google_vignette,Salamat : début de la campagne de vaccination conjointe de bétail contre la péripneumonie contagieuse bovine et la peste des petits ruminants,"Accueil»Salamat : début de la campagne de vaccination conjointe de bétail contre la péripneumonie contagieuse bovine et la peste des petits ruminants Gouroumouday, un village situé à 17 kilomètres au sud d’Amtiman, a abrité la cérémonie de lancement de la campagne de vaccination conjointe de bétail contre la péripneumonie contagieuse bovine (PPCB) et la peste des petits ruminants (PPR) ce 18 janvier 2024. C’est le secrétaire général provincial du Salamat Maab Mara qui a officié ladite cérémonie en présence de plusieurs autorités qui ont fait le déplacement, des éleveurs nomades sédentarisés. Dans son intervention, le Délégué provincial de l’Elevage, Dr Mahamat Bichara Saleh informe que les objectifs visés par cette campagne conjointe sont entre autres : Cette vaccination contre la PPCB est obligatoire et coûte 100 frs par tête alors que celle de la PPR est gratuite. Le Délégué demande la contribution des autorités administratives, traditionnelles, notamment les chefs des cantons, les organisations des pasteurs, les khalifas et aussi les partenaires de les aider à atteindre les objectifs en présentant tous les animaux aux centres de vaccination. «Pour les besoins adéquats, les équipes dynamiques de vaccination seront déployés aux terrains après le lancement et vont sillonner tous les départements, les sous – préfectures, les cantons, ferricks et les zones de concertation pour vacciner« , informe-t-il. Lançant officiellement la campagne de vaccination conjointe de bétail contre la péripneumonie contagieuse bovine et la peste des petits ruminants, le secrétaire général provincial du Salamat Maab Mara a déclaré que l’objectif global du gouvernement et ceux de ses partenaires ( PRAPS-2 et RePER ) est d’améliorer le taux de la couverture vaccinale et réduire ainsi le taux de prévalence de la PPCB et la PPR dans le pays. À cet effet pour cette campagne conjointe 134 400 doses de périvax et 1 000 000 de doses de Lyopox sont à mises à disposition pour sécuriser le cheptel de la province . Tout en invitant toute la communauté des éleveurs à présenter la totalité de leurs bétails dans les centres de vaccination, il a encouragé les agents vaccinateurs d’être plus charismatiques dans l’exécution de leurs tâches afin de répondre à la mission assignée à la délégation provinciale de l’élevage du Salamat. Djimotoum Bongtoloum, correspondant à Amtiman Votre adresse e-mail ne sera pas publiée.Les champs obligatoires sont indiqués avec* Commentaire* Nom* E-mail* Enregistrer mon nom, mon e-mail et mon site dans le navigateur pour mon prochain commentaire.  Ne ratez rien de notre actualité et recevez dans votre boîte email les dernières nouvelles de Tchadinfos !  J'ai lu et j'accepte les conditions d'utilisation",fr,2739,426,19-01-2024,Tchad,Peste Des Petits Ruminants,Media,tchadinfos.com,,"Lançant officiellement la campagne de vaccination conjointe de bétail contre la péripneumonie contagieuse bovine et la peste des petits ruminants, le secrétaire général provincial du Salamat Maab Mara a déclaré que l’objectif global du gouvernement et ceux de ses partenaires ( PRAPS-2 et RePER ) est d’améliorer le taux de la couverture vaccinale et réduire ainsi le taux de prévalence de la PPCB et la PPR dans le pays.","Accueil»Salamat : début de la campagne de vaccination conjointe de bétail contre la péripneumonie contagieuse bovine et la peste des petits ruminants Gouroumouday, un village situé à 17 kilomètres au sud d’Amtiman, a abrité la cérémonie de lancement de la campagne de vaccination conjointe de bétail contre la péripneumonie contagieuse bovine (PPCB) et la peste des petits ruminants (PPR) ce 18 janvier 2024. Lançant officiellement la campagne de vaccination conjointe de bétail contre la péripneumonie contagieuse bovine et la peste des petits ruminants, le secrétaire général provincial du Salamat Maab Mara a déclaré que l’objectif global du gouvernement et ceux de ses partenaires ( PRAPS-2 et RePER ) est d’améliorer le taux de la couverture vaccinale et réduire ainsi le taux de prévalence de la PPCB et la PPR dans le pays.","Accueil, Amtiman, Bichara, Bongtoloum, Cette, Commentaire, Dans, Djimotoum, Dr, Elevage, Enregistrer, Gouroumouday, Le, Les, Lyopox, Maab, Mahamat, Mara, Ne, Nom, PPCB, PPR, PRAPS, Pour, RePER, Salamat, Saleh, Tchadinfos, Tout, Votre"
code654,https://www.elbalad.news/6082639,تحصين 51 ألف طائر بلقاح الإنفلونزا في كفر الشيخ,تابع اللواء جمال نور الدين، محافظ كفر الشيخ، اليوم الإثنين، جهود مديرية الطب البيطري في تحصين 51 ألفاً و580 طائراً متنوعاً بلقاح إنفلونزا الطيور، برئاسة الدكتور محمد بشار مدير مديرية الطب البيطري، والدكتور هشام علام، مدير إدارة الدواجن بالمدريرية. قال محافظ كفر الشيخ، إنه تم تحصين 51 ألفا و580 طائراً ضد الأمراض الوبائية، وذلك في إطار مكافحة مرض إنفلونزا الطيور، وتطهير عدد من الأسواق ومحال بيع الدواجن. وتابع: كما تم سحب 130 عينة ما قبل البيع من 13 مزرعة بإجمالي 67 ألفاً و300 طائر، ومنح 33 تصريح نقل للطيور الحية، وذلك في إطار جهود الدولة للحفاظ على الثروة الداجنة والصحة العامة للمواطنين. جميع الحقوق محفوظة لموقع صدى البلد  2025 ©  |,ar,638,111,22-01-2024,Unknown,Unknown,Media,elbalad.news,تابع اللواء جمال نور الدين، محافظ كفر الشيخ، اليوم الإثنين، جهود مديرية الطب البيطري في تحصين 51 ألفاً و580 طائراً متنوعاً بلقاح إنفلونزا الطيور، برئاسة الدكتور محمد بشار مدير مديرية الطب البيطري، والدكتور هشام علام، مدير إدارة الدواجن بالمدريرية.,تابع اللواء جمال نور الدين، محافظ كفر الشيخ، اليوم الإثنين، جهود مديرية الطب البيطري في تحصين 51 ألفاً و580 طائراً متنوعاً بلقاح إنفلونزا الطيور، برئاسة الدكتور محمد بشار مدير مديرية الطب البيطري، والدكتور هشام علام، مدير إدارة الدواجن بالمدريرية. قال محافظ كفر الشيخ، إنه تم تحصين 51 ألفا و580 طائراً ضد الأمراض الوبائية، وذلك في إطار مكافحة مرض إنفلونزا الطيور، وتطهير عدد من الأسواق ومحال بيع الدواجن.,تابع اللواء جمال نور الدين، محافظ كفر الشيخ، اليوم الإثنين، جهود مديرية الطب البيطري في تحصين 51 ألفاً و580 طائراً متنوعاً بلقاح إنفلونزا الطيور، برئاسة الدكتور محمد بشار مدير مديرية الطب البيطري، والدكتور هشام علام، مدير إدارة الدواجن بالمدريرية. قال محافظ كفر الشيخ، إنه تم تحصين 51 ألفا و580 طائراً ضد الأمراض الوبائية، وذلك في إطار مكافحة مرض إنفلونزا الطيور، وتطهير عدد من الأسواق ومحال بيع الدواجن. وتابع: كما تم سحب 130 عينة ما قبل البيع من 13 مزرعة بإجمالي 67 ألفاً و300 طائر، ومنح 33 تصريح نقل للطيور الحية، وذلك في إطار جهود الدولة للحفاظ على الثروة الداجنة والصحة العامة للمواطنين. جميع الحقوق محفوظة لموقع صدى البلد  2025 ©  |,
code655,https://alamedapost.com/news/first-west-nile-positive-dead-bird-found-in-2024/,First West Nile Positive Dead Bird Found in 2024,"Donate! TheAlameda County Mosquito Abatement District(ACMAD) has reported the first dead bird that tested positive for West Nile virus in Alameda County this year. The dead bird was found in Union City and tested at ACMAD’s laboratory on January 19, 2024. Last summer, an Alameda resident was thefirst to test positive in 2023for West Nile Virus in the county, although the location of where the infection occurred was not determined.  “While this early detection of West Nile virus at the start of the year is a surprise, it is not unprecedented,” ACMAD Lab Director Eric Haas-Stapleton PhD explained. “Our ever-shifting weather patterns of rain and sunshine provide opportunity for mosquitoes to be active throughout the year. Our team will continue to test for mosquitoes in the surrounding area. We appreciate the public’s help in locating dead birds and encourage everyone to contact theCalifornia Dead Bird Hotlineto report a dead bird, no matter where it is found. Remember to reduce mosquito habitats by dumping or draining any containers that hold water or reach out to our district if you have standing water in your community.” ACMAD will increase mosquito monitoring and larval control efforts in the area where the West Nile virus positive bird was discovered. They are making every effort to locate areas of standing water where mosquitoes may breed—including, but not limited to, catch basins, storm drain systems, and swimming pools. Neglected swimming pools are an ongoing mosquito breeding issue in Alameda County. If you know of an unmaintained swimming pool, inform ACMAD so they can make the proper treatment. Transmission of West Nile virus most commonly occurs from a mosquito bite. Mosquitoes can get West Nile virus when they bite an infected bird. In turn, the mosquito can then pass the virus to humans. The best thing people can do to protect themselves from West Nile virus is to avoid mosquitoes and report any dead birds. Approximately one in five people who are infected with West Nile virus will develop symptoms such as fever, headache, body aches, joint pains, vomiting, or rash. Less than one percent will develop a serious neurological illness such as encephalitis or meningitis. There is no cure for West Nile virus. Adults over 50 years old and people with compromised immune systems are at increased risk of serious complications. Anyone who develops symptoms should seek medical care immediately. There are many ways to avoid mosquitoes and reduce their population: For information about mosquitoes, West Nile virus, or to request any ACMAD services visitwww.mosquitoes.orgor call (510) 783-7744. Residents can also request mosquitofish for their fishponds, horse troughs, or neglected swimming pools at the ACMAD office located at 23187 Connecticut St. in Hayward. For information concerning West Nile virus symptoms, prevention or testing please contact the Alameda County Public Health Department at (510) 267-8001. First Night of Hanukkah Lights Up Bohol Immigrant Circle Park Opinion: Who’s Putting the AI into Alameda Island? Alameda Health System Wins Equity Award for Breast Cancer Screening Campaign Rotary Club of Alameda Awards $24,000 to Local Nonprofits “We Fight Back.” Alameda Officials Rally Against VA’s Cancellation of Veterans Projects AUSD Board Approves First Interim Budget, Rotates Roles Green Your Holiday Season Foodbank Players’ ‘A Christmas Carol’ Especially Meaningful This Year State Grants $44.5 Million for Supportive Housing at Alameda Point Harbor Seals Rest on Commercial Dock in Seaplane Lagoon Has the VA Quit Alameda Point? Lighted Yacht Parade Sparkles on the Estuary ©2021–2025 Alameda Post Inc. All Rights Reserved.Alameda Post Inc. is a 501(c)(3) nonprofit corporation. Our tax ID is 874572048. Now through December 31, contributions up to a total of $25,000 will be doubled by a coalition of local funders plus NewsMatch. 12 times your new monthly giftordoubleyour one-time giftwill be matched up to $1,000. That means that, through NewsMatch,we can earn up to $50,000.",en,4052,635,22-01-2024,Unknown,Rage,Media,alamedapost.com,Remember to reduce mosquito habitats by dumping or draining any containers that hold water or reach out to our district if you have standing water in your community.” ACMAD will increase mosquito monitoring and larval control efforts in the area where the West Nile virus positive bird was discovered.,Remember to reduce mosquito habitats by dumping or draining any containers that hold water or reach out to our district if you have standing water in your community.” ACMAD will increase mosquito monitoring and larval control efforts in the area where the West Nile virus positive bird was discovered.,"Remember to reduce mosquito habitats by dumping or draining any containers that hold water or reach out to our district if you have standing water in your community.” ACMAD will increase mosquito monitoring and larval control efforts in the area where the West Nile virus positive bird was discovered. Alameda Health System Wins Equity Award for Breast Cancer Screening Campaign Rotary Club of Alameda Awards $24,000 to Local Nonprofits “We Fight Back.” Alameda Officials Rally Against VA’s Cancellation of Veterans Projects AUSD Board Approves First Interim Budget, Rotates Roles Green Your Holiday Season Foodbank Players’ ‘A Christmas Carol’ Especially Meaningful This Year State Grants $44.5 Million for Supportive Housing at Alameda Point Harbor Seals Rest on Commercial Dock in Seaplane Lagoon Has the VA Quit Alameda Point?","ACMAD, AI, AUSD, Abatement, Adults, Against, Alameda, All, Anyone, Approves, Approximately, Award, Awards, Back, Bird, Board, Bohol, Breast, Budget, Campaign, Cancellation, Cancer, Carol, Christmas, Circle, City, Club, Commercial, Connecticut, County, Dead, December, Department, Director, District, Dock, Donate, Equity, Eric, Especially, Estuary, Fight, First, Foodbank, For, Grants, Green, Haas, Hanukkah, Harbor, Has, Hayward, Health, Holiday, Hotlineto, Housing, ID, If, Immigrant, In, Inc, Inte"
code656,https://elwatan-dz.com/vaccination-du-cheptel-contre-la-fievre-aphteuse,Vaccination du cheptel contre la fièvre aphteuse,"L’inspection du vétérinaire de la wilaya a mobilisé tous ses moyens humain et matériel pour réussir la campagne de vaccination contre la fièvre aphteuse, opération qu’elle a entamée il y a quelques jours en direction des foyers  d’élevage. «Dès que la maladie a été déclarée, nous nous sommes lancés dans une opération de détectage dans les différentes étables établies sur le territoire de la wilaya où nos agents ont signalé la présence de deux foyers, le premier au douar Bransia, dans la commune de Zemmora, et le second au lieu dit Kaflazreg dans la commune de Sidi Lazreg», a souligné un cadre de cette inspection. «Ces deux indices, ajoute notre source, ont suffi pour annoncer la vaccination de tout le cheptel de la wilaya. Ainsi, les différentes brigades engagées ont réussi jusque-là la vaccination de pas moins de 17 970 têtes, dont 8700 vaches laitières», a précisé le cadre, en affirmant que l’opération se poursuit pour venir au bout des 23 000 têtes recensées sur le territoire de la wilaya. Avant ça, le vétérinaire a affirmé que toutes les têtes avérées infectées par la maladie ont été isolées.I. B. Tendances de la Semaine Catégories Populaires Le quotidien El Watan a été lancé le 8 octobre 1990, dans le sillage des réformes politiques, par vingt journalistes regroupés dans la SPA El Watan. Premier journal indépendant du matin, d’expression française, à être édité en Algérie, il a basé sa ligne éditoriale sur un traitement objectif de l’information, en développant des analyses pertinentes, une vérification rigoureuse des informations publiées et un souci constant d’ouverture à l’ensemble des sensibilités politiques du pays, notamment celle de l’opposition démocratique. ©El Watan All Rights Reserved.",fr,1730,278,23-01-2024,Algérie,Fièvre Aphteuse,Media,elwatan-dz.com,,"«Dès que la maladie a été déclarée, nous nous sommes lancés dans une opération de détectage dans les différentes étables établies sur le territoire de la wilaya où nos agents ont signalé la présence de deux foyers, le premier au douar Bransia, dans la commune de Zemmora, et le second au lieu dit Kaflazreg dans la commune de Sidi Lazreg», a souligné un cadre de cette inspection.","«Dès que la maladie a été déclarée, nous nous sommes lancés dans une opération de détectage dans les différentes étables établies sur le territoire de la wilaya où nos agents ont signalé la présence de deux foyers, le premier au douar Bransia, dans la commune de Zemmora, et le second au lieu dit Kaflazreg dans la commune de Sidi Lazreg», a souligné un cadre de cette inspection. Ainsi, les différentes brigades engagées ont réussi jusque-là la vaccination de pas moins de 17 970 têtes, dont 8700 vaches laitières», a précisé le cadre, en affirmant que l’opération se poursuit pour venir au bout des 23 000 têtes recensées sur le territoire de la wilaya.","Ainsi, All, Avant, Bransia, Ces, El, Kaflazreg, Lazreg, Le, Populaires, Premier, Reserved, Rights, SPA, Semaine, Sidi, Tendances, Watan, Zemmora"
